{
  "opendb_id": "bac72766-4dc1-475a-98c9-e71d3d86b16b",
  "metadata": {
    "name": "IKEA LAGKAPTEN / ADILS Desk 47 1/4x23 5/8 \"",
    "manufacturer": "IKEA",
    "part_numbers": ["s49417021"],
    "series": "LAGKAPTEN 47 1/4x23 5/8 \"",
    "variant": "Black-Brown/Black w/ ADILS"
  },
  "general_product_information": {
    "manufacturer_url": "https://www.ikea.com/us/en/p/lagkapten-adils-desk-black-brown-black-s49417021/"
  },
  "identifiers": {
    "version": 1,
    "identifiers": [
      {
        "type": "mpn",
        "value": "s49417021",
        "region": "all"
      }
    ],
    "retailer_listings": []
  }
}
