{
  "opendb_id": "ac71bea6-0644-466a-84eb-603568677fc8",
  "metadata": {
    "name": "IKEA LAGKAPTEN / ALEX Desk 55 1/8x23 5/8 \"",
    "manufacturer": "IKEA",
    "part_numbers": ["s89521520"],
    "series": "LAGKAPTEN 55 1/8 x 23 5/8''",
    "variant": "Black-Brown w/ White ALEX"
  },
  "general_product_information": {
    "manufacturer_url": "https://www.ikea.com/us/en/p/lagkapten-alex-desk-black-brown-white-s89521520/"
  },
  "identifiers": {
    "version": 1,
    "identifiers": [
      {
        "type": "mpn",
        "value": "s89521520",
        "region": "all"
      }
    ],
    "retailer_listings": []
  }
}
