{
  "opendb_id": "b4adb76d-bfc5-4f9d-9271-da6713ca31d4",
  "metadata": {
    "name": "IKEA LAGKAPTEN / ALEX Desk 78 3/4x23 5/8 \"",
    "manufacturer": "IKEA",
    "part_numbers": ["s89521695"],
    "series": "LAGKAPTEN 78 3/4x23 5/8 \"",
    "variant": "White w/ ALEX"
  },
  "general_product_information": {
    "manufacturer_url": "https://www.ikea.com/us/en/p/lagkapten-alex-desk-white-s89521695/"
  },
  "identifiers": {
    "version": 1,
    "identifiers": [
      {
        "type": "mpn",
        "value": "s89521695",
        "region": "all"
      }
    ],
    "retailer_listings": []
  }
}
