{
  "opendb_id": "146129d8-1003-404c-8596-3e2a9aa04283",
  "metadata": {
    "name": "VIVO STAND-V002W Dual Monitor Desk Mount (13 - 30) White",
    "manufacturer": "VIVO",
    "part_numbers": [],
    "releaseYear": 2012
  },
  "general_product_information": {
    "manufacturer_url": "https://vivo-us.com/products/stand-v002?variant=46857001500948"
  },
  "identifiers": {
    "version": 2,
    "identifiers": [],
    "retailer_listings": [
      {
        "source": "amazon",
        "channel": "us",
        "source_product_id": "B083G6P7WH",
        "pricing_enabled": true,
        "verified": true
      },
      {
        "source": "walmart",
        "channel": "us",
        "source_product_id": "250679480",
        "pricing_enabled": true,
        "verified": true
      }
    ]
  }
}
