{
  "opendb_id": "9041996e-cf31-4538-b2d8-062dbca57228",
  "metadata": {
    "name": "IKEA LAGKAPTEN / ALEX Desk 78 3/4x23 5/8 \" White",
    "manufacturer": "IKEA",
    "part_numbers": ["s59417619"],
    "series": "LAGKAPTEN 78 3/4x23 5/8 \"",
    "variant": "White w/ 2 ALEX Drawers"
  },
  "general_product_information": {
    "manufacturer_url": "https://www.ikea.com/us/en/p/lagkapten-alex-desk-white-s59417619/"
  },
  "identifiers": {
    "version": 1,
    "identifiers": [
      {
        "type": "mpn",
        "value": "s59417619",
        "region": "all"
      }
    ],
    "retailer_listings": []
  }
}
