{
  "opendb_id": "dd8359b4-e44a-452c-8949-9d0f8efcf60a",
  "metadata": {
    "name": "IKEA LAGKAPTEN / ALEX Desk 78 3/4x23 5/8 \"",
    "manufacturer": "IKEA",
    "part_numbers": ["s99417622"],
    "series": "LAGKAPTEN 78 3/4x23 5/8 \"",
    "variant": "White w/ 2 Black ALEX Drawers"
  },
  "general_product_information": {
    "manufacturer_url": "https://www.ikea.com/us/en/p/lagkapten-alex-desk-white-black-brown-s99417622/"
  },
  "identifiers": {
    "version": 1,
    "identifiers": [
      {
        "type": "mpn",
        "value": "s99417622",
        "region": "all"
      }
    ],
    "retailer_listings": []
  }
}
