{
  "opendb_id": "46901da3-ec92-4a6c-9fd3-11e544e9ef66",
  "metadata": {
    "name": "IKEA LAGKAPTEN / ALEX Desk 55 1/8x23 5/8 \"",
    "manufacturer": "IKEA",
    "part_numbers": ["s49521490"],
    "series": "LAGKAPTEN 55 1/8 x 23 5/8''",
    "variant": "Black/Brown w/ Black ALEX"
  },
  "general_product_information": {
    "manufacturer_url": "https://www.ikea.com/us/en/p/lagkapten-alex-desk-black-brown-black-s49521490/"
  },
  "identifiers": {
    "version": 1,
    "identifiers": [
      {
        "type": "mpn",
        "value": "s49521490",
        "region": "all"
      }
    ],
    "retailer_listings": []
  }
}
