{
  "opendb_id": "9f9eb83d-73bc-4faa-b937-94f8e845a7a2",
  "metadata": {
    "name": "IKEA LAGKAPTEN / 2 ALEX, 78 3/4x23 5/8 \"white/black-brown",
    "manufacturer": "IKEA",
    "part_numbers": [],
    "series": "LAGKAPTEN 78 3/4x23 5/8 \"",
    "variant": "White w/ 2 Black-Brown ALEX Drawers",
    "releaseYear": 2021
  },
  "general_product_information": {
    "manufacturer_url": "https://www.ikea.com/in/en/p/lagkapten-alex-desk-white-black-brown-s59417624/"
  },
  "identifiers": {
    "version": 1,
    "identifiers": [],
    "retailer_listings": []
  }
}
