{
  "opendb_id": "949c3d05-b94f-4272-bee4-7365fab7f1e8",
  "metadata": {
    "name": "IKEA LAGKAPTEN / 2 ALEX, 55 1/8x23 5/8 \" Gray/wood effect",
    "manufacturer": "IKEA",
    "part_numbers": [],
    "series": "LAGKAPTEN 55 1/8 x 23 5/8''",
    "variant": "Grey/Wood w/ 2 Alex Drawers",
    "releaseYear": 2021
  },
  "general_product_information": {
    "manufacturer_url": "https://www.ikea.com/in/en/p/lagkapten-alex-desk-grey-wood-effect-s99585451/#content"
  },
  "identifiers": {
    "version": 1,
    "identifiers": [],
    "retailer_listings": []
  }
}
